"Choice, with single answer";"20";"What is the smallest planet in our solar system? 1. Earth 2. Jupiter 3. Mercury";"Mercury"
"Choice, with multiple answers";"20";"Which of the following are prime numbers? 1. 2 2. 4 3. 7 4. 9";"2/7"
"True/False";"10";"Is the sun a star?";"True"
"Choice, with single answer";"20";"Who wrote the novel '1984'? 1. George Orwell 2. J.K. Rowling 3. Mark Twain";"George Orwell"
"Choice, with multiple answers";"20";"Which of the following are metals? 1. Iron 2. Oxygen 3. Gold 4. Hydrogen";"Iron/Gold"
"True/False";"10";"Is water a compound?";"True"